<?xml version="1.0" encoding="UTF-8"?>
<Faktura xmlns:xsi="http://www.w3.org/2001/XMLSchema-instance"
 xsi:noNamespaceSchemaLocation="file:/D:/FTN/PINF/sema_fakture.xsd" Broj="umu5GDo5xN">
    <Datum_izdavanja>2017-11-03Z</Datum_izdavanja>
    <Datum_valute>2017-10-26</Datum_valute>
    <Podaci_o_izdavaocu>
        <Naziv>kfoXzsuhrL-gcaZ-66hVFSSfa.gjAR</Naziv>
        <Adresa>z82</Adresa>
        <Tekuci_racun>zePkQJPsOf4sn9GN7ZR</Tekuci_racun>
        <Maticni_broj>HbYfMirQ</Maticni_broj>
        <PIB>X9splPdsj</PIB>
    </Podaci_o_izdavaocu>
    <Podaci_o_kupcu>
        <Naziv>mo9fRb</Naziv>
        <Adresa>bPsr</Adresa>
        <Tekuci_racun>lvrRJy8sv</Tekuci_racun>
        <Maticni_broj>WcvaxGBv</Maticni_broj>
        <PIB>eSBoZU0ZN</PIB>
    </Podaci_o_kupcu>
    <Stavka_fakture>
        <Sifra_robe>Ov7</Sifra_robe>
        <Naziv_robe>FA6</Naziv_robe>
        <Jedinica_mere>H</Jedinica_mere>
        <Kolicina>600687529</Kolicina>
        <Jedinicna_cena>1323498322.93</Jedinicna_cena>
        <Rabat>85</Rabat>
        <Vrednost_stavke>1027245254.77</Vrednost_stavke>
        <Poreska_osnovica>386132406.49</Poreska_osnovica>
        <Stopa_PDV>334.12</Stopa_PDV>
        <Iznos_PDV>352104208.96</Iznos_PDV>
        <Prodajna_vrednost>1483220571.59</Prodajna_vrednost>
    </Stavka_fakture>
    <Stavka_fakture>
        <Sifra_robe>KvHkPJ</Sifra_robe>
        <Naziv_robe>fM3Fe97WhKW</Naziv_robe>
        <Jedinica_mere>Cvt</Jedinica_mere>
        <Kolicina>357278288</Kolicina>
        <Jedinicna_cena>935176521.20</Jedinicna_cena>
        <Rabat>10</Rabat>
        <Vrednost_stavke>1784843224.17</Vrednost_stavke>
        <Poreska_osnovica>1389637697.70</Poreska_osnovica>
        <Stopa_PDV>676.77</Stopa_PDV>
        <Iznos_PDV>316358944.00</Iznos_PDV>
        <Prodajna_vrednost>1168491048.41</Prodajna_vrednost>
    </Stavka_fakture>
    <Iznos>1833177254.33</Iznos>
    <Ukupan_rabat>388948908.39</Ukupan_rabat>
    <Ukupna_poreska_osnova>1041467282.43</Ukupna_poreska_osnova>
    <Ukupan_PDV>228009531.50</Ukupan_PDV>
    <Ukupno_za_uplatu>614312657.35</Ukupno_za_uplatu>
</Faktura>
